{
  "id": "EV-0002",
  "kind": "evidence_pack",
  "change_request": "CR-0004",
  "status": "submitted",
  "acceptance_checklist": [
    {
      "criterion": "The consultation draft defines the canonical v0.1 control-plane layout and serialization policy",
      "result": "pass"
    },
    {
      "criterion": "Schemas, examples, and dogfood objects omit optional fields instead of serializing null",
      "result": "pass"
    },
    {
      "criterion": "The CLI init and new commands follow the same control-plane contract",
      "result": "pass"
    }
  ],
  "artifacts": [
    {
      "path": "docs/consultation/CCP_PUBLIC_CONSULTATION_DRAFT.md"
    },
    {
      "path": "schemas/"
    },
    {
      "path": "tests/test_cli_contract.py"
    }
  ],
  "unresolved_risks": []
}
